original_title,original_review,cleaned_text,rating,date,language
Expert-level pizza folding,Their thin-crust slices fold perfectly New York-style without cracking or losing toppings. The slight resistance before the fold is exactly what you want - showing the perfect balance of crisp and chew.,expert level pizza fold thin crust slice fold perfectly New York style crack lose topping slight resistance fold exactly want show perfect balance crisp chew,5,2024-03-10,en
No flavor distinction,Ordered two completely different specialty pizzas but they somehow tasted nearly identical. It's like they use the same base for everything and the toppings don't impart enough distinctive character.,flavor distinction order completely different specialty pizza taste nearly identical like use base topping impart distinctive character,3,2024-01-17,en
Righteous ranch drizzle,Their house-made ranch drizzle takes their pizzas to another level. It's not your typical ranch - has hints of dill and garlic with a perfect consistency that adds creaminess without making things soggy.,righteous ranch drizzle house ranch drizzle take pizza level typical ranch hint dill garlic perfect consistency add creaminess make thing soggy,5,2024-02-03,en
Too much cheese,"There is such a thing as too much cheese, and this place proves it. The excessive cheese made the pizza so heavy and greasy that it was unpleasant to eat. Quality should matter more than quantity.",cheese thing cheese place prove excessive cheese pizza heavy greasy unpleasant eat Quality matter quantity,2,2024-03-04,en
Perfect crunch factor,"The bottom of their crust has the perfect level of crunch - you hear it when you bite in, but it's not so hard that it hurts your mouth. Technical pizza perfection that's clearly the result of careful testing.",perfect crunch factor crust perfect level crunch hear bite hard hurt mouth technical pizza perfection clearly result careful testing,5,2024-01-24,en
Burned mouth on first bite,"They served the pizza dangerously hot - barely out of the oven with no time to cool. Severely burned the roof of my mouth on the first bite, which ruined the rest of the meal and my next few days.",burn mouth bite serve pizza dangerously hot barely oven time cool severely burn roof mouth bite ruin rest meal day,2,2024-02-20,en
Superior ingredients make the difference,"They import their flour from Italy, use San Marzano tomatoes, and make their mozzarella in-house daily. The commitment to quality ingredients is evident in every bite - nothing is an afterthought.",superior ingredient difference import flour Italy use San Marzano tomato mozzarella house daily commitment quality ingredient evident bite afterthought,5,2024-03-18,en
Underwhelming and basic,"Nothing particularly wrong with it, but nothing memorable either. Standard crust, standard sauce, standard toppings. In a city with so many pizza options, this place doesn't give you any reason to return.",underwhelme basic particularly wrong memorable standard crust standard sauce standard topping city pizza option place reason return,3,2024-01-09,en
Excellent attention to cooking time,They nail the cooking time perfectly - pulling the pizza from the oven at exactly the right moment when the cheese is fully melted and bubbling but not yet browned. Shows expertise and attention to detail.,excellent attention cooking time nail cooking time perfectly pull pizza oven exactly right moment cheese fully melt bubble brown show expertise attention detail,5,2024-02-22,en
False advertising on size,"Their menu clearly states that a large pizza is 16 inches, but what we received couldn't have been more than 14 inches. When questioned, they claimed their menu was outdated but refused any adjustment.",false advertising size menu clearly state large pizza inch receive inch question claim menu outdate refuse adjustment,2,2024-03-12,en
Perfect ingredient distribution,"Every bite had the perfect combination of ingredients - no barren spots, no overwhelming clumps. The toppings were distributed with such precision it almost seemed measured. The mark of true professionals!",perfect ingredient distribution bite perfect combination ingredient barren spot overwhelming clump topping distribute precision measured mark true professional,5,2024-01-06,en
Lackluster veggie options,"Their vegetable toppings lacked freshness and flavor - the mushrooms were clearly canned, the peppers were soft and faded, and the onions were sparse. Disappointing for a place that advertises farm-fresh ingredients.",Lackluster veggie option vegetable topping lack freshness flavor mushroom clearly can pepper soft fade onion sparse disappoint place advertise farm fresh ingredient,3,2024-02-19,en
Ideal char-to-chew ratio,The small charred bubbles on the crust add amazing flavor without dominating. They've mastered that balance between the slight bitterness of char and the natural sweetness of the dough. Technical perfection!,ideal char chew ratio small charred bubble crust add amazing flavor dominating master balance slight bitterness char natural sweetness dough technical perfection,5,2024-03-03,en
Cheese solidified too quickly,"The cheese hardened into a solid mass before we were even halfway through the pizza. By the end, it was like eating a cheese cracker on bread. Suggests poor quality cheese or improper handling.",Cheese solidify quickly cheese harden solid mass halfway pizza end like eat cheese cracker bread suggest poor quality cheese improper handling,2,2024-01-31,en
Brilliant buffalo chicken pizza,"Their buffalo chicken pizza balances spicy and creamy perfectly - the chicken is actually high-quality and juicy (not the dry cubes many places use), and the blue cheese is distributed perfectly for balanced bites.",brilliant buffalo chicken pizza buffalo chicken pizza balance spicy creamy perfectly chicken actually high quality juicy dry cube place use blue cheese distribute perfectly balanced bite,5,2024-02-15,en
No-cheese option was all sauce,"Ordered a cheese-free pizza for my dairy-allergic friend, but they made no adjustments - just removed the cheese and left a soggy sauce-covered bread. Good pizza without cheese requires rebalancing other elements.",cheese option sauce order cheese free pizza dairy allergic friend adjustment remove cheese leave soggy sauce cover bread good pizza cheese require rebalance element,2,2024-03-11,en
Outstanding breakfast pizza,"Their brunch pizza with bacon, eggs, and hollandaise sauce is incredible. The eggs are perfectly cooked with runny yolks that create a rich sauce when broken. Worth waking up early for weekend brunch!",outstanding breakfast pizza brunch pizza bacon egg hollandaise sauce incredible egg perfectly cook runny yolk create rich sauce break worth wake early weekend brunch,5,2024-01-14,en
Painfully obvious cheap ingredients,"The pre-shredded cheese didn't melt properly, the sauce tasted like it came from a can, and the sausage had that distinctive processed flavor. At these prices, cutting corners on ingredients is inexcusable.",painfully obvious cheap ingredient pre shredded cheese melt properly sauce taste like come sausage distinctive process flavor price cut corner ingredient inexcusable,2,2024-02-08,en
Perfect for late-night cravings,"Open until 3am on weekends, this place has saved many late nights. The slices are huge, they reheat them perfectly so they're crispy, and their special late-night menu items are creative and delicious.",perfect late night craving Open weekend place save late night slice huge reheat perfectly crispy special late night menu item creative delicious,5,2024-03-07,en
Too thin to be satisfying,"Their ultra-thin crust might appeal to some, but it was too insubstantial to be satisfying. Felt like I was eating toppings on a cracker rather than a proper pizza. Left still feeling hungry.",thin satisfy ultra thin crust appeal insubstantial satisfy felt like eat topping cracker proper pizza left feel hungry,3,2024-01-25,en
Masterful use of olive oil,"The drizzle of high-quality olive oil they add just before serving makes all the difference - adds richness, enhances the flavors of the other ingredients, and adds a wonderful aromatic element. Simple but transformative.",masterful use olive oil drizzle high quality olive oil add serve make difference adds richness enhance flavor ingredient add wonderful aromatic element simple transformative,5,2024-02-28,en
Absurdly small slices,"Their 8-slice large pizza had slices so small they were almost comical - two bites and they're gone. For the price charged, the portion size is simply unacceptable. Felt like a ripoff.",absurdly small slice slice large pizza slice small comical bite go price charge portion size simply unacceptable felt like ripoff,2,2024-03-05,en
Perfect balance of herbs in the sauce,"Their sauce has a complex herb profile that evolves as you eat - initial notes of basil give way to oregano, with subtle garlic and a hint of fennel in the finish. Clearly made by someone who understands flavor development.",perfect balance herb sauce sauce complex herb profile evolve eat initial note basil way oregano subtle garlic hint fennel finish clearly understand flavor development,5,2024-01-02,en
Tough leathery crust,"The crust was so tough I almost couldn't bite through it - like trying to eat leather. The edges were particularly problematic, had to tear pieces off with significant effort. Completely lacks the pleasant chewiness good pizza should have.",tough leathery crust crust tough bite like try eat leather edge particularly problematic tear piece significant effort completely lack pleasant chewiness good pizza,2,2024-02-04,en
Exceptional spinach ricotta pie,Their white pizza with spinach and ricotta is exceptional - the creamy richness of the cheese balanced by the slight bitterness of the greens. The garlic-infused olive oil base ties everything together perfectly.,exceptional spinach ricotta pie white pizza spinach ricotta exceptional creamy richness cheese balance slight bitterness green garlic infuse olive oil base tie perfectly,5,2024-03-09,en
Sloppy presentation,"The pizza looked like it had been assembled in a hurry - toppings haphazardly thrown on, cheese unevenly distributed, and the cutting was so uneven that some slices were twice the size of others. Taste was okay, but appearance matters too.",sloppy presentation pizza look like assemble hurry topping haphazardly throw cheese unevenly distribute cutting uneven slice twice size Taste okay appearance matter,3,2024-01-13,en
Brilliant seasonal rotation,"Love that they have a rotating seasonal pizza that showcases what's fresh. The current spring offering with asparagus, green garlic, and fresh peas is bright and delicious - a perfect reflection of the season.",brilliant seasonal rotation Love rotate seasonal pizza showcase fresh current spring offering asparagus green garlic fresh pea bright delicious perfect reflection season,5,2024-02-23,en
Way too much crust,The edge crust (cornicione) was comically large - almost half of each slice was just bread with no toppings. This ratio of crust to actual pizza was way off and made for a disappointing experience.,way crust edge crust cornicione comically large half slice bread topping ratio crust actual pizza way disappointing experience,2,2024-03-16,en
Perfect textural contrast,"The contrast between the crisp bottom, the tender interior crumb, the gooey cheese, and the slight resistance of the toppings creates a textural symphony. Each bite is interesting and satisfying in a different way.",perfect textural contrast contrast crisp tender interior crumb gooey cheese slight resistance topping create textural symphony bite interesting satisfy different way,5,2024-01-18,en
Unmelted cheese in the center,"The edges were fine but the center had cold, unmelted cheese - a sign the oven wasn't hot enough or the pizza wasn't cooked long enough. Basic pizza fundamentals seem to be lacking.",unmelted cheese center edge fine center cold unmelted cheese sign oven hot pizza cook long basic pizza fundamental lack,2,2024-02-06,en
Innovative flavor combinations,"Their 'Avant Garde' menu section features combinations I would never have thought of but somehow work perfectly. The pear, gorgonzola, walnut, and honey pizza was a revelation of sweet, salty, and savory harmony.",innovative flavor combination Avant Garde menu section feature combination think work perfectly pear gorgonzola walnut honey pizza revelation sweet salty savory harmony,5,2024-03-13,en
Burned bottom raw top,The bottom of the crust was completely black while the cheese on top wasn't fully melted. This temperature imbalance suggests serious issues with their oven management and pizza-making technique.,burn raw crust completely black cheese fully melt temperature imbalance suggest issue oven management pizza make technique,1,2024-01-20,en
Perfect for watching sports,"Great setup with TVs visible from every table, excellent pitcher specials during games, and their 'Game Day' pizza loaded with multiple meats and jalapeños is the perfect sports-watching food. Atmosphere gets lively but not obnoxious.",perfect watch sport great setup tv visible table excellent pitcher special game Game Day pizza load multiple meat jalapeños perfect sport watch food atmosphere get lively obnoxious,4,2024-02-27,en
Sauce had an odd chemical taste,The sauce had a strange artificial flavor - almost like they used sauce mix rather than real tomatoes. Had an unpleasant chemical aftertaste that lingered long after eating. Very disappointing.,Sauce odd chemical taste sauce strange artificial flavor like sauce mix real tomato unpleasant chemical aftertaste linger long eat disappointing,2,2024-03-02,en
Outstanding wood-fired perfection,The wood-fired oven gives their pizza a distinctive smoky complexity you can't get any other way. The slight char adds bitterness that balances the sweetness of the sauce perfectly. Worth seeking out for this unique flavor profile.,outstanding wood fire perfection wood fire oven give pizza distinctive smoky complexity way slight char add bitterness balance sweetness sauce perfectly worth seek unique flavor profile,5,2024-01-04,en
Too much salt in the dough,The crust was so salty it was almost inedible - overwhelmed all the other flavors and left me incredibly thirsty afterward. A heavy hand with salt ruined what could have been a good pizza.,salt dough crust salty inedible overwhelm flavor leave incredibly thirsty afterward heavy hand salt ruin good pizza,2,2024-02-10,en
Excellence in simplicity,"Their classic Margherita showcases their commitment to quality - the balance of sweet-acidic tomato sauce, creamy fresh mozzarella, fragrant basil, and that perfectly chewy-crisp crust. Proof that simple can be sublime.",excellence simplicity classic Margherita showcase commitment quality balance sweet acidic tomato sauce creamy fresh mozzarella fragrant basil perfectly chewy crisp crust Proof simple sublime,5,2024-03-19,en
Suspiciously uniform toppings,"All the vegetable toppings were cut in precisely identical shapes and sizes, suggesting they came pre-cut from a food service provider rather than being prepared fresh in-house as claimed. Tasted fine but felt deceived by the marketing.",suspiciously uniform topping vegetable topping cut precisely identical shape size suggest come pre cut food service provider prepare fresh house claim taste fine felt deceive marketing,3,2024-01-30,en
Perfect niche for Roman-style pizza,"Their Roman-style pizza al taglio (rectangular, with a focaccia-like base) is a welcome alternative to the usual round pies. The airy, light crust holds up wonderfully to the creative topping combinations. A distinctive option in a crowded pizza market.",perfect niche roman style pizza roman style pizza al taglio rectangular focaccia like base welcome alternative usual round pie airy light crust hold wonderfully creative topping combination distinctive option crowded pizza market,5,2024-02-25,en
Pizza barely survived the drive home,"Ordered takeout and by the time I got home (15 minutes), the pizza was a soggy mess. They clearly don't use appropriate packaging for takeout - no vents to release steam means the crust steams itself into sogginess.",Pizza barely survive drive home order takeout time get home minute pizza soggy mess clearly use appropriate packaging takeout vent release steam mean crust steam sogginess,2,2024-03-04,en
Magnificent flavor layering,"The thoughtful layering of ingredients creates a perfect progression of flavors - the spicy soppressata reveals the sweetness of the roasted red peppers, which contrasts with the brininess of the olives. Every bite is a journey.",magnificent flavor layer thoughtful layering ingredient create perfect progression flavor spicy soppressata reveal sweetness roasted red pepper contrast brininess olive bite journey,5,2024-01-15,en
Crust like cardboard,"The crust had all the flavor and texture of packing material - dry, tough, and completely devoid of character. Even the decent toppings couldn't save it. The foundation of good pizza is good dough, and this wasn't it.",crust like cardboard crust flavor texture pack material dry tough completely devoid character decent topping save foundation good pizza good dough,2,2024-02-12,en
Perfect for large parties,"Their party package is fantastic - multiple 18-inch pizzas with varied toppings, plenty of sides, and they were accommodating with our group of 20. Everything arrived hot and on time, and they included all the necessary paper goods.",perfect large party party package fantastic multiple inch pizza varied topping plenty side accommodate group arrive hot time include necessary paper good,5,2024-03-14,en
False advertising on ingredients,"Menu promised 'house-made Italian sausage' but what came on my pizza was clearly pre-formed, uniform pellets of commercial sausage. When questioned, staff admitted they don't make any ingredients in-house despite menu claims.",false advertising ingredient Menu promise house italian sausage come pizza clearly pre form uniform pellet commercial sausage question staff admit ingredient house despite menu claim,1,2024-01-08,en
Supreme quality control,"Visited multiple times and the consistency is impressive - every pizza comes out identical to the last one, with the same excellent quality. Shows serious commitment to training and standards that's rare in casual dining.",Supreme quality control visit multiple time consistency impressive pizza come identical excellent quality show commitment training standard rare casual dining,5,2024-02-18,en
Pizza arrived upside-down,Delivery driver must have taken a sharp turn because our pizza arrived completely flipped over in the box - all toppings stuck to the lid. Restaurant offered no solution other than suggesting we 'scrape it off and reassemble it.',Pizza arrive upside Delivery driver take sharp turn pizza arrive completely flip box topping stick lid restaurant offer solution suggest scrape reassemble,1,2024-03-06,en
Exceptional sauce-making technique,"You can tell their sauce is made with properly hand-crushed tomatoes - it has that perfect texture with small chunks rather than being completely smooth. The bright flavor suggests minimal cooking, allowing the tomato quality to shine.",exceptional sauce making technique tell sauce properly hand crush tomato perfect texture small chunk completely smooth bright flavor suggest minimal cooking allow tomato quality shine,5,2024-01-26,en
Too much emphasis on appearance,"The pizza was clearly designed to look good in photos - perfect symmetry, vibrant colors, photogenic cheese pull - but the flavor was underwhelming. Style over substance for the Instagram crowd.",emphasis appearance pizza clearly design look good photo perfect symmetry vibrant color photogenic cheese pull flavor underwhelming style substance Instagram crowd,3,2024-02-14,en
Brilliant use of fermented dough,Their 72-hour fermented dough has incredible depth of flavor with subtle sourdough notes. The extended fermentation creates a complex web of flavors and perfect texture that you simply can't achieve with quick-rise methods.,brilliant use fermented dough hour ferment dough incredible depth flavor subtle sourdough note extended fermentation create complex web flavor perfect texture simply achieve quick rise method,5,2024-03-17,en
Excessive grease pooling,"Had to continuously blot the pizza with napkins as pools of orange grease formed on top of the cheese with every passing minute. By the end, the napkins were completely saturated and transparent. Felt unhealthy even by pizza standards.",excessive grease pooling continuously blot pizza napkin pool orange grease form cheese pass minute end napkin completely saturate transparent felt unhealthy pizza standard,2,2024-01-22,en
Perfect for dietary restrictions,"As someone with multiple food allergies, I appreciate that they take dietary concerns seriously. Their allergen matrix is comprehensive, staff is knowledgeable, and they have proper protocols to prevent cross-contamination. Finally can enjoy pizza safely!",perfect dietary restriction multiple food allergy appreciate dietary concern seriously allergen matrix comprehensive staff knowledgeable proper protocol prevent cross contamination finally enjoy pizza safely,5,2024-02-09,en
Tasteless cheese substitute,"Their vegan cheese option was terrible - had no meltability, a grainy texture, and tasted strongly of coconut which clashed with the tomato sauce. If you can't do vegan cheese well, better to offer cheese-free options that are properly balanced.",tasteless cheese substitute vegan cheese option terrible meltability grainy texture taste strongly coconut clash tomato sauce vegan cheese well offer cheese free option properly balanced,2,2024-03-01,en
Masterclass in proper baking,"Watching the pizzaiolo work the oven is like watching an artist - constantly rotating pizzas, adjusting their position based on hot spots, and pulling each one at precisely the right moment. This attention to the baking process makes all the difference.",masterclass proper baking watch pizzaiolo work oven like watch artist constantly rotate pizza adjust position base hot spot pull precisely right moment attention baking process make difference,5,2024-01-10,en
Tomato sauce tasted rancid,"The sauce had a distinctly off flavor that suggested the tomatoes had gone bad before processing. After two bites, couldn't continue eating as the rancid notes became more pronounced. Basic food safety seems questionable.",tomato sauce taste rancid sauce distinctly flavor suggest tomato go bad processing bite continue eat rancid note pronounced basic food safety questionable,1,2024-02-16,en
Perfect buffalo mozzarella application,They understand that buffalo mozzarella shouldn't be cooked too long or it loses its distinctive texture and flavor. Applied in dollops after the pizza is mostly baked so it just barely melts while maintaining its creamy integrity. Technical perfection!,perfect buffalo mozzarella application understand buffalo mozzarella cook long lose distinctive texture flavor apply dollop pizza bake barely melt maintain creamy integrity technical perfection,5,2024-03-20,en
